{
  "schemaVersion": "lekalo/module-api-report/v0.8.0",
  "identity": "dev.lekalo.module-api-report@0.8.0",
  "assessment": "pass",
  "command": "check",
  "strict": false,
  "moduleFilter": null,
  "pins": {
    "project": "tasks",
    "modelVersion": "0.2.16",
    "irDigest": "sha256:f60bad30f53d2b660eaeeafcc4cabb55a529f5baa0e69e7cf9a4160199a8614e",
    "attachmentDigest": "sha256:ab3c7dc3371d3613a0fb04b79afe084fd515a1c0eaf352d217e0b1fe6a4249b7",
    "registryVersion": "0.8.0"
  },
  "modules": [
    {
      "moduleId": "planner",
      "apiVersion": null,
      "attachment": true,
      "exports": 0,
      "imports": [
        "tasks"
      ],
      "consumers": 0,
      "publicDigest": null
    },
    {
      "moduleId": "provider",
      "apiVersion": null,
      "attachment": false,
      "exports": 0,
      "imports": [],
      "consumers": 0,
      "publicDigest": null
    },
    {
      "moduleId": "tasks",
      "apiVersion": "1.2.0",
      "attachment": true,
      "exports": 9,
      "imports": [],
      "consumers": 1,
      "publicDigest": "sha256:dd02bc7d30d9894c01707851627477e83e360004c872fdc89b9a841fccf30136"
    }
  ],
  "findings": [],
  "cycles": [],
  "gaps": [],
  "complete": true
}